,bibkey,type,title,authors,ss_id,all_ss_ids,comment,year
3,Abel19,article,"Computational pathology definitions, best practices, and recommendations for regulatory guidance: a white paper from the Digital Pathology Association","Abels, Esther and Pantanowitz, Liron and Aeffner, Famke and Zarella, Mark D and van der Laak, Jeroen and Bui, Marilyn M and Vemuri, Venkata Np and Parwani, Anil V and Gibbs, Jeff and Agosto-Arroyo, Emmanuel and Beck, Andrew H and Kozlowski, Cleopatra",,,,2019.0
19,Amga20,article,Report on computational assessment of Tumor Infiltrating Lymphocytes from the International Immuno-Oncology Biomarker Working Group,Mohamed Amgad and and Elisabeth Specht Stovgaard and Eva Balslev and Jeppe Thagaard and Weijie Chen and Sarah Dudgeon and Ashish Sharma and Jennifer K. Kerner and Carsten Denkert and Yinyin Yuan and Khalid AbdulJabbar and Stephan Wienert and Peter Savas and Leonie Voorwerk and Andrew H. Beck and Anant Madabhushi and Johan Hartman and Manu M. Sebastian and Hugo M. Horlings and Jan Hude{\v{c}}ek and Francesco Ciompi and David A. Moore and Rajendra Singh and Elvire Roblin and Marcelo Luiz Balancin and Marie-Christine Mathieu and Jochen K. Lennerz and Pawan Kirtani and I-Chun Chen and Jeremy P. Braybrooke and Giancarlo Pruneri and Sandra Demaria and Sylvia Adams and Stuart J. Schnitt and Sunil R. Lakhani and Federico Rojo and Laura Comerma and Sunil S. Badve and Mehrnoush Khojasteh and W. Fraser Symmans and Christos Sotiriou and Paula Gonzalez-Ericsson and Katherine L. Pogue-Geile and Rim S. Kim and David L. Rimm and Giuseppe Viale and Stephen M. Hewitt and John M. S. Bartlett and Fr{\'{e}}d{\'{e}}rique Penault-Llorca and Shom Goel and Huang-Chun Lien and Sibylle Loibl and Zuzana Kos and Sherene Loi and Matthew G. Hanna and Stefan Michiels and Marleen Kok and Torsten O. Nielsen and Alexander J. Lazar and Zsuzsanna Bago-Horvath and Loes F. S. Kooreman and Jeroen A. W. M. van der Laak and Joel Saltz and Brandon D. Gallas and Uday Kurkure and Michael Barnes and Roberto Salgado and Lee A. D. Cooper,b4c4c3dc91d42114023b0575c3e2273b87446ff7,"['69999230b02054b82254684a73bb8a4c83878d28', 'b4c4c3dc91d42114023b0575c3e2273b87446ff7']","title matching: single bibkey with multiple_ss_ids (['69999230b02054b82254684a73bb8a4c83878d28', 'b4c4c3dc91d42114023b0575c3e2273b87446ff7']), took the first one with most citations",2020.0
21,Anto21,article,The Medical Segmentation Decathlon,Michela Antonelli and Annika Reinke and Spyridon Bakas and Keyvan Farahani and AnnetteKopp-Schneider and Bennett A. Landman and Geert Litjens and Bjoern Menze and Olaf Ronneberger and Ronald M. Summers and Bram van Ginneken and Michel Bilello and Patrick Bilic and Patrick F. Christ and Richard K. G. Do and Marc J. Gollub and Stephan H. Heckers and Henkjan Huisman and William R. Jarnagin and Maureen K. McHugo and Sandy Napel and Jennifer S. Goli Pernicka and Kawal Rhode and Catalina Tobon-Gomez and Eugene Vorontsov and Henkjan Huisman and James A. Meakin and Sebastien Ourselin and Manuel Wiesenfarth and Pablo Arbelaez and Byeonguk Bae and Sihong Chen and Laura Daza and Jianjiang Feng and Baochun He and Fabian Isensee and Yuanfeng Ji and Fucang Jia and Namkug Kim and Ildoo Kim and Dorit Merhof and Akshay Pai and Beomhee Park and Mathias Perslev and Ramin Rezaiifar and Oliver Rippel and Ignacio Sarasua and Wei Shen and Jaemin Son and Christian Wachinger and Liansheng Wang and Yan Wang and Yingda Xia and Daguang Xu and Zhanwei Xu and Yefeng Zheng and Amber L. Simpson and Lena Maier-Hein and M. Jorge Cardoso,,,,2021.0
22,Anto22,article,The {Medical} {Segmentation} {Decathlon,"Antonelli, Michela and Reinke, Annika and Bakas, Spyridon and Farahani, Keyvan and Kopp-Schneider, Annette and Landman, Bennett A. and Litjens, Geert and Menze, Bjoern and Ronneberger, Olaf and Summers, Ronald M. and van Ginneken, Bram and Bilello, Michel and Bilic, Patrick and Christ, Patrick F. and Do, Richard K. G. and Gollub, Marc J. and Heckers, Stephan H. and Huisman, Henkjan and Jarnagin, William R. and McHugo, Maureen K. and Napel, Sandy and Pernicka, Jennifer S. Golia and Rhode, Kawal and Tobon-Gomez, Catalina and Vorontsov, Eugene and Meakin, James A. and Ourselin, Sebastien and Wiesenfarth, Manuel and Arbelaez, Pablo and Bae, Byeonguk and Chen, Sihong and Daza, Laura and Feng, Jianjiang and He, Baochun and Isensee, Fabian and Ji, Yuanfeng and Jia, Fucang and Kim, Ildoo and Maier-Hein, Klaus and Merhof, Dorit and Pai, Akshay and Park, Beomhee and Perslev, Mathias and Rezaiifar, Ramin and Rippel, Oliver and Sarasua, Ignacio and Shen, Wei and Son, Jaemin and Wachinger, Christian and Wang, Liansheng and Wang, Yan and Xia, Yingda and Xu, Daguang and Xu, Zhanwei and Zheng, Yefeng and Simpson, Amber L. and Maier-Hein, Lena and Cardoso, M. Jorge",979a9f247700d00ff2c3f0612d5eb001379f93c8,"['979a9f247700d00ff2c3f0612d5eb001379f93c8', 'c397c6f1480ac8e3ed875adad96e9b3e00c37f26']","multiple doi matches ['979a9f247700d00ff2c3f0612d5eb001379f93c8', 'c397c6f1480ac8e3ed875adad96e9b3e00c37f26'], took the first one with most citations",2022.0
26,Ares18,article,iW-Net}: an automatic and minimalistic interactive lung nodule segmentation deep network,Guilherme Aresta and Colin Jacobs and Teresa Ara\'{u}jo and A. Cunha and Isabel Ramos and Bram van Ginneken and A. Campilho,,,,2018.0
29,Argu19,article,Function Follows Form: Regression from Complete Thoracic Computed Tomography Scans,"Argus, Max and Schaefer-Prokop, Cornelia and Lynch, David A. and van Ginneken, Bram",6425e3f4c37f8deb9e8dc933e34d49aa843635b9,"['6425e3f4c37f8deb9e8dc933e34d49aa843635b9', 'cc7605f2b7e61723f12839fabc1066da0cc8744b']","title matching: single bibkey with multiple_ss_ids (['6425e3f4c37f8deb9e8dc933e34d49aa843635b9', 'cc7605f2b7e61723f12839fabc1066da0cc8744b']), took the first one with most citations",2019.0
55,Balk19,article,Deep learning and manual assessment show that the absolute mitotic count does not contain prognostic information in triple negative breast cancer,"Balkenhol, Maschenka C A and Bult, Peter and Tellez, David and Vreuls, Willem and Clahsen, Pieter C and Ciompi, Francesco and van der Laak, Jeroen A W M",94962ef85aca6df5c8289874b56bcaa8722dc596,"['91bcebba717670d740ef76097a0885a0bd3c9dde', '94962ef85aca6df5c8289874b56bcaa8722dc596']","title matching: single bibkey with multiple_ss_ids (['91bcebba717670d740ef76097a0885a0bd3c9dde', '94962ef85aca6df5c8289874b56bcaa8722dc596']), took the first one with most citations",2019.0
65,Balt19b,article,Optimization of the difference-of-Gaussian channel sets for the channelized Hotelling observer,"Balta, Christiana and Bouwman, Ramona W and Broeders, Mireille JM and Karssemeijer, Nico and Veldkamp, Wouter JH and Sechopoulos, Ioannis and van Engen, Ruben E",f131ef217543d179269018950bf3b6ba2b30f3b1,"['20fe29e553477d9bd330f052e4d01c0c1c616b22', 'f131ef217543d179269018950bf3b6ba2b30f3b1']","title matching: single bibkey with multiple_ss_ids (['20fe29e553477d9bd330f052e4d01c0c1c616b22', 'f131ef217543d179269018950bf3b6ba2b30f3b1']), took the first one with most citations",2019.0
70,Band23,article,Continual learning strategies for cancer-independent detection of lymph node metastases,"B\'{a}ndi, P. and Balkenhol, Maschenka and van Dijk, Marcory and Kok, Michel and van Ginneken, Bram and van der Laak, Jeroen and Litjens, Geert",bc6b483f9b1fa630fa4b43158b13716f1ca7497b,"['4bcd672218ecec70473c84f6f1cc52c64031f3e5', 'bc6b483f9b1fa630fa4b43158b13716f1ca7497b']","title matching: single bibkey with multiple_ss_ids (['4bcd672218ecec70473c84f6f1cc52c64031f3e5', 'bc6b483f9b1fa630fa4b43158b13716f1ca7497b']), took the first one with most citations",2023.0
93,Bili19,article,The {L}iver {T}umor {S}egmentation {B}enchmark ({L}i{TS}),"Patrick Bilic and Patrick Ferdinand Christ and Eugene Vorontsov and Grzegorz Chlebus and Hao Chen and Qi Dou and Chi-Wing Fu and Xiao Han and Pheng-Ann Heng and Jurgen Hesser and Samuel Kadoury and Tomasz Konopczynski and Miao Le and Chunming Li and Xiaomeng Li and Jana Lipkova and John Lowengrub and Hans Meine and Jan Hendrik Moltz and Chris Pal and Marie Piraud and Xiaojuan Qi and Jin Qi and Markus Rempfler and Karsten Roth and Andrea Schenk and Anjany Sekuboyina and Eugene Vorontsov and Ping Zhou and Christian Hulsemeyer and Marcel Beetz and Florian Ettlinger and Felix Gruen and Georgios Kaissis and Fabian Lohofer and Rickmer Braren and Julian Holch and Felix Hofmann and Wieland Sommer and Volker Heinemann and Colin Jacobs and Humpire Mamani, Gabriel Efrain and Bram van Ginneken and Gabriel Chartrand and An Tang and Michal Drozdzal and Avi Ben-Cohen and Eyal Klang and Marianne M. Amitai and Eli Konen and Hayit Greenspan and Johan Moreau and Alexandre Hostettler and Luc Soler and Refael Vivanti and Adi Szeskin and Naama Lev-Cohain and Jacob Sosna and Leo Joskowicz and Bjoern H. Menze",,,,2019.0
110,Bokh19b,article,Assessment of individual tumor buds using keratin immunohistochemistry: moderate interobserver agreement suggests a role for machine learning,"Bokhorst, John-Melle and Blank, A. and Lugli, A. and Zlobec, I. and Dawson, H. and Vieth, M. and Rijstenberg, L. L. and Brockmoeller, S. and Urbanowicz, M. and Flejou, J. F. and Kirsch, R. and Ciompi, F. and van der Laak, J. A. W. M. and Nagtegaal, I. D.",c3e98e4b01c27affe1b6c161172c5e27e8141618,"['aff9f3cd8024fb64c7ea36d396a36ebf33d01f5b', 'c3e98e4b01c27affe1b6c161172c5e27e8141618']","title matching: single bibkey with multiple_ss_ids (['aff9f3cd8024fb64c7ea36d396a36ebf33d01f5b', 'c3e98e4b01c27affe1b6c161172c5e27e8141618']), took the first one with most citations",2019.0
171,Bult19,article,Epithelium segmentation using deep learning in H\&E-stained prostate specimens with immunohistochemistry as reference standard,Wouter Bulten and P\'{e}ter B\'{a}ndi and Jeffrey Hoven and Rob {van de Loo} and Johannes Lotz and Nick Weiss and Jeroen {van der Laak} and Bram {van Ginneken} and Christina {Hulsbergen-van de Kaa} and Geert Litjens,d5b8fba71671814445de80d36a2d563f43eb9d07,"['b0cc9473a96dcd45dd1c7de2d7d217c2a453a850', 'd5b8fba71671814445de80d36a2d563f43eb9d07']","title matching: single bibkey with multiple_ss_ids (['b0cc9473a96dcd45dd1c7de2d7d217c2a453a850', 'd5b8fba71671814445de80d36a2d563f43eb9d07']), took the first one with most citations",2019.0
177,Busc16,article,Risk factors for COPD exacerbations in inhaled medication users: the COPDGene study biannual longitudinal follow-up prospective cohort,"Busch, Robert and Han, MeiLan K and Bowler, Russell P and Dransfield, Mark T and Wells, J Michael and Regan, Elizabeth A and Hersh, Craig P and {COPDGene Investigators",,,,2016.0
197,Char18,article,Automatic segmentation of the solid core and enclosed vessels in subsolid pulmonary nodules,"Charbonnier, Jean-Paul and Chung, Kaman and Scholten, Ernst T and van Rikxoort, Eva M and Jacobs, Colin and Sverzellati, Nicola and Silva, Mario and Pastorino, Ugo and van Ginneken, Bram and Ciompi, Francesco",3ed451d2830a2afcbbd254f0015eeafa796ba1b7,"['3ed451d2830a2afcbbd254f0015eeafa796ba1b7', '4fd1ad386d794e9baff286b212013b3b44bb7bd3']","title matching: single bibkey with multiple_ss_ids (['3ed451d2830a2afcbbd254f0015eeafa796ba1b7', '4fd1ad386d794e9baff286b212013b3b44bb7bd3']), took the first one with most citations",2018.0
200,Chle18,article,Automatic liver tumor segmentation in {CT} with fully convolutional neural networks and object-based postprocessing,"Chlebus, Grzegorz and Schenk, Andrea and Moltz, Jan Hendrik and van Ginneken, Bram and Hahn, Horst Karl and Meine, Hans",27cebb08aca785444166209593fc0ec740469b1b,"['27cebb08aca785444166209593fc0ec740469b1b', '96438076b4dfa87956f55c0d8cef9c198de2beb7']","title matching: single bibkey with multiple_ss_ids (['27cebb08aca785444166209593fc0ec740469b1b', '96438076b4dfa87956f55c0d8cef9c198de2beb7']), took the first one with most citations",2018.0
232,Ciom17a,article,Towards automatic pulmonary nodule management in lung cancer screening with deep learning,F. Ciompi and K. Chung and S. J. van Riel and A. A. A. Setio and P. K. Gerke and C. Jacobs and E. Th. Scholten and C. M. Schaefer-Prokop and M. M. W. Wille and A. Marchiano and U. Pastorino and M. Prokop and B. van Ginneken,fd0901b1f2121506391a7859de8fb695d159a393,"['86b9d39fb026746752f95f87f87fd26b8512c913', 'fd0901b1f2121506391a7859de8fb695d159a393']","title matching: single bibkey with multiple_ss_ids (['86b9d39fb026746752f95f87f87fd26b8512c913', 'fd0901b1f2121506391a7859de8fb695d159a393']), took the first one with most citations",2017.0
246,Dama22,article,A Comparison Between Single- and Multi-Scale Approaches for Classification of Histopathology Images,Marina D'Amato and Przemys{\l}aw Szostak and Benjamin Torben-Nielsen,,,,2022.0
292,Emau15,article,MR} Imaging as an Additional Screening Modality for the Detection of Breast Cancer in Women Aged 50-75 Years with Extremely Dense Breasts: The {DENSE} Trial Study Design,"Emaus, Marleen J. and Bakker, Marije F. and Peeters, Petra H M. and Loo, Claudette E. and Mann, Ritse M. and {de Jong}, Mathijn D F. and Bisschops, Robertus H C. and Veltman, Jeroen and Duvivier, Katya M. and Lobbes, Marc B I. and Pijnappel, Ruud M. and Karssemeijer, Nico and {de Koning}, Harry J. and {van den Bosch}, Maurice A A J. and Monninkhof, Evelyn M. and Mali, Willem P Th M. and Veldhuis, Wouter B. and {van Gils}, Carla H.",fb1084b454e9b6f203c860e6f89ca4389cd1a8e9,"['fb1084b454e9b6f203c860e6f89ca4389cd1a8e9', 'fc7b70a4d154e3d2dfabe4393809dfb29cc36a7a']","title matching: single bibkey with multiple_ss_ids (['fb1084b454e9b6f203c860e6f89ca4389cd1a8e9', 'fc7b70a4d154e3d2dfabe4393809dfb29cc36a7a']), took the first one with most citations",2015.0
310,Fary20a,inproceedings,Attention-guided classification of abnormalities in semi-structured computed tomography reports,Khrystyna Faryna and Fakrul I. Tushar and Vincent M. D'Anniballe and Rui Hou and Geoffrey D. Rubin and Joseph Y. Lo,,,,2020.0
341,Gall17,article,Computed tomography quantification of tracheal abnormalities in {COPD} and their influence on airflow limitation,"Gallardo Estrella, Leticia and Pompe, Esther and Kuhnigk, Jan-Martin and Lynch, David A and Bhatt, Surya P and van Ginneken, Bram and van Rikxoort, Eva Marjolein",e15e0cd21632aa9d6643b314a4d1d1a6580f2b39,"['d1e0a041fc417d82c584191ecf5b3b536127d9e0', 'e15e0cd21632aa9d6643b314a4d1d1a6580f2b39']","title matching: single bibkey with multiple_ss_ids (['d1e0a041fc417d82c584191ecf5b3b536127d9e0', 'e15e0cd21632aa9d6643b314a4d1d1a6580f2b39']), took the first one with most citations",2017.0
349,Garc15,inproceedings,Comparing regional breast density using {F}ull-{F}ield {D}igital {M}ammograms and {M}agnetic {R}esonance {I}maging: A preliminary study,"Garcia, E. and Oliver, A. and Diez, Y. and Diaz O. and Georgii, J. and Gubern-M\'{e}rida, A. and Mart\'{i}, J. and Mart\'{i}, R.",,,,2015.0
350,Garc16,inproceedings,Comparison of Four Breast Tissue Segmentation Algorithms for Multi-modal MRI to X-ray Mammography Registration,"Garc\'{i}a, E. and Oliver, A. and Diez, Y. and Diaz, O. and Gubern-M\'{e}rida, A. and Llad\'{o}, X. and Mart\'{i}, J.",,,,2016.0
354,Gees19,article,Computer aided quantification of intratumoral stroma yields an independent prognosticator in rectal cancer,"Geessink, Oscar and Baidoshvili, Alexi and Klaase, Joost and Ehteshami Bejnordi, Babak and Litjens, Geert and van Pelt, Gabi and Mesker, Wilma and Nagtegaal, Iris and Ciompi, Francesco and van der Laak, Jeroen",c7ce6b90707871b922aca4cb6a8b16625980788b,"['2d7797e69a35b5ffe021a2762ef251764562dca4', 'c7ce6b90707871b922aca4cb6a8b16625980788b']","title matching: single bibkey with multiple_ss_ids (['2d7797e69a35b5ffe021a2762ef251764562dca4', 'c7ce6b90707871b922aca4cb6a8b16625980788b']), took the first one with most citations",2019.0
359,Geor16,inproceedings,Simulation and Visualization to Support Breast Surgery Planning,"Georgii, J. and Paetz, T. and Harz, M. and Stoecker, C. and Rothgang, M. and Colletta, J. and Schilling, K. and Schlooz-Vries, M. and Mann, R.M. and Hahn, H. K.",,,,2016.0
360,Gern18,article,Automatic quantification of calcifications in the coronary arteries and thoracic aorta on radiotherapy planning {CT} scans of {Western} and {Asian} breast cancer patients,"Gernaat, Sofie A. M. and van Velzen, Sanne G. M. and Koh, Vicky and Emaus, Marleen J. and I{\v{s}}gum, Ivana and Lessmann, Nikolas and Moes, Shinta and Jacobson, Anouk and Tan, Poey W. and Grobbee, Diederick E. and van den Bongard, Desiree H. J. and Tang, Johann I. and Verkooijen, Helena M.",,,,2018.0
367,Ghaf17c,article,Location Sensitive Deep Convolutional Neural Networks for Segmentation of White Matter Hyperintensities,Mohsen Ghafoorian and Nico Karssemeijer and Tom Heskes and Inge van Uden and Clara I. S\'{a}nchez and Geert Litjens and Frank-Erik de Leeuw and Bram van Ginneken and Elena Marchiori and Bram Platel,91feb0cb04d67a5c38d0a4e7c67fc7874491abc6,"['91feb0cb04d67a5c38d0a4e7c67fc7874491abc6', '925024223075dcc5b4db81f4b07eddf2cbdf4519']","title matching: single bibkey with multiple_ss_ids (['91feb0cb04d67a5c38d0a4e7c67fc7874491abc6', '925024223075dcc5b4db81f4b07eddf2cbdf4519']), took the first one with most citations",2017.0
419,Ginn17,article,"Fifty years of computer analysis in chest imaging: rule-based, machine learning, deep learning","van Ginneken, Bram",b69fe5a837277ddbea5215d6bacd3a902e9d11ce,"['46479bbea7749cb2db35b139206039531327053c', 'b69fe5a837277ddbea5215d6bacd3a902e9d11ce']","title matching: single bibkey with multiple_ss_ids (['46479bbea7749cb2db35b139206039531327053c', 'b69fe5a837277ddbea5215d6bacd3a902e9d11ce']), took the first one with most citations",2017.0
423,Ginn20,article,The Potential of Artificial Intelligence to Analyze Chest Radiographs for Signs of {COVID}-19 Pneumonia,Bram van Ginneken,11cfab281e93fa7803931be8b589aa1f09d7af02,"['11cfab281e93fa7803931be8b589aa1f09d7af02', '8c4fab5306f4c4e179cfae2acd3427fb5d661627']","title matching: single bibkey with multiple_ss_ids (['11cfab281e93fa7803931be8b589aa1f09d7af02', '8c4fab5306f4c4e179cfae2acd3427fb5d661627']), took the first one with most citations",2020.0
435,Gonz19b,article,Iterative augmentation of visual evidence for weakly-supervised lesion localization in deep interpretability frameworks,"Gonz\'{a}lez-Gonzalo, Cristina and Liefers, Bart and van Ginneken, Bram and S\'{a}nchez, Clara I",,,,2019.0
443,Goud20,article,Tussen data en theorie,"Goudsmit, Jeroen and Teuwen, Jonas",,,,2020.0
476,Gube15d,inproceedings,Pectoral muscle surface segmentation in automated 3{D} breast ultrasound using cylindrical transform and atlas information,"Gubern-M\'{e}rida, A. and Tan, T. and van Zelst, J. and Mann, R. M. and Platel, B. and Karssemeijer, N.",,,,2015.0
482,Habi20,article,Evaluation of computer aided detection of tuberculosis on chest radiography among people with diabetes in Karachi Pakistan,"Habib, Shifa Salman and Rafiq, Sana and Zaidi, Syed Mohammad Asad and Ferrand, Rashida Abbas and Creswell, Jacob and Van Ginneken, Bram and Jamal, Wafa Zehra and Azeemi, Kiran Sohail and Khowaja, Saira and Khan, Aamir",13122b7c0ef4a596875eff981651d60140e67417,"['13122b7c0ef4a596875eff981651d60140e67417', '142f9f46a9ca5a99de4c7b819d801d245a9334ba']","title matching: single bibkey with multiple_ss_ids (['13122b7c0ef4a596875eff981651d60140e67417', '142f9f46a9ca5a99de4c7b819d801d245a9334ba']), took the first one with most citations",2020.0
500,Hayd15a,article,Childhood pneumonia increases risk for chronic obstructive pulmonary disease: the COPDGene study,"Hayden, Lystra P. and Hobbs, Brian D. and Cohen, Robyn T. and Wise, Robert A. and Checkley, William and Crapo, James D. and Hersh, Craig P. and {COPDGene Investigators",,,,2015.0
501,Hayd18,article,Childhood asthma is associated with COPD and known asthma variants in COPDGene: a genome-wide association study,"Hayden, Lystra P and Cho, Michael H and Raby, Benjamin A and Beaty, Terri H and Silverman, Edwin K and Hersh, Craig P and COPDGene Investigators",,,,2018.0
502,Hees19,article,Genetic risk score has added value over initial clinical grading stage in predicting disease progression in age-related macular degeneration,"Heesterbeek, Thomas J and de Jong, Eiko K and Acar, Ilhan E and Groenewoud, Joannes M M and Liefers, Bart and S\'{a}nchez, Clara I. and Peto, Tunde and Hoyng, Carel B and Pauleikhoff, Daniel and Hense, Hans W and den Hollander, Anneke I",560e2100afbc64953c5155459b1f459f6e55003e,"['560e2100afbc64953c5155459b1f459f6e55003e', '65e6296fe63fbf76519ef01e16b5e62bfabbc3ca']","title matching: single bibkey with multiple_ss_ids (['560e2100afbc64953c5155459b1f459f6e55003e', '65e6296fe63fbf76519ef01e16b5e62bfabbc3ca']), took the first one with most citations",2019.0
523,Herm21,article,Quantitative assessment of inflammatory infiltrates in kidney transplant biopsies using multiplex tyramide signal amplification and deep learning,"Hermsen, Meyke AND Volk, Valery AND Brasen, Jan Hinrich AND Geijs, Daan J AND Gwinner, Wilfried AND Kers, Jesper AND Linmans, Jasper AND Schaadt, Nadine S AND Schmitz, Jessica AND Steenbergen, Eric J AND Swiderska-Chadaj, Zaneta AND Smeets, Bart AND Hilbrands, Luuk L AND van der Laak, Jeroen A W M",3881ae992914cd50a14782104170cc5dd5d9ae7e,"['3881ae992914cd50a14782104170cc5dd5d9ae7e', 'a4d4e42f1accfd77f378549c776b7c850afbcda5']","title matching: single bibkey with multiple_ss_ids (['3881ae992914cd50a14782104170cc5dd5d9ae7e', 'a4d4e42f1accfd77f378549c776b7c850afbcda5']), took the first one with most citations",2021.0
528,Heuv17a,article,Development of a Low-Cost Medical Ultrasound Scanner Using a Monostatic Synthetic Aperture,Thomas L. A. van den Heuvel and David J. Graham and Kristopher J. Smith and Chris L. de Korte and Jeffrey A. Neasham,,,,2017.0
565,Holl17c,article,Influence of breast compression pressure on the performance of population-based mammography screening,"Holland, K. and Sechopoulos, I. and Mann, R. M. and {den Heeten}, G. J. and {van Gils}, C. H. and Karssemeijer, N.",817c6ab7fde2a45210b6b80c4713b9147b3eba19,"['16352b9da95fb7a2643f617b61c56669b07879c8', '817c6ab7fde2a45210b6b80c4713b9147b3eba19']","title matching: single bibkey with multiple_ss_ids (['16352b9da95fb7a2643f617b61c56669b07879c8', '817c6ab7fde2a45210b6b80c4713b9147b3eba19']), took the first one with most citations",2017.0
655,Jara15,article,Reduced Bone Density and Vertebral Fractures in Smokers. Men and COPD Patients at Increased Risk,"Jaramillo, Joshua D. and Wilson, Carla and Stinson, Douglas S. and Stinson, Douglas J. and Lynch, David A. and Bowler, Russell P. and Lutz, Sharon and Bon, Jessica M. and Arnold, Ben and McDonald, Merry-Lynn N. and Washko, George R. and Wan, Emily S. and DeMeo, Dawn L. and Foreman, Marilyn G. and Soler, Xavier and Lindsay, Sarah E. and Lane, Nancy E. and Genant, Harry K. and Silverman, Edwin K. and Hokanson, John E. and Make, Barry J. and Crapo, James D. and Regan, Elizabeth A. and {COPD Gene Investigators",,,,2015.0
717,Kaze18,article,GANs for Medical Image Analysis,Salome Kazeminia and Christoph Baur and Arjan Kuijper and Bram van Ginneken and Nassir Navab and Shadi Albarqouni and Anirban Mukhopadhyay,,,,2018.0
725,Kloo15,article,Endobronchial Valves for Emphysema without Interlobar Collateral Ventilation,"Klooster, Karin and {ten Hacken}, Nick H T. and Hartman, Jorine E. and Kerstjens, Huib A M. and {van Rikxoort}, Eva M. and Slebos, Dirk-Jan",,,,2015.0
741,Koni20,article,Reduced Lung-Cancer Mortality with Volume CT Screening in a Randomized Trial,"de Koning, Harry J and van der Aalst, Carlijn M and de Jong, Pim A and Scholten, Ernst T and Nackaerts, Kristiaan and Heuvelmans, Marjolein A and Lammers, Jan-Willem J and Weenink, Carla and Yousaf-Khan, Uraujh and Horeweg, Nanda and van 't Westeinde, Susan and Prokop, Mathias and Mali, Willem P and Mohamed Hoesein, Firdaus A A and van Ooijen, Peter M A and Aerts, Joachim G J V and den Bakker, Michael A and Thunnissen, Erik and Verschakelen, Johny and Vliegenthart, Rozemarijn and Walter, Joan E and Ten Haaf, Kevin and Groen, Harry J M and Oudkerk, Matthijs",,,,2020.0
747,Kooi17d,article,Classifying Symmetrical Differences and Temporal Change in Mammography Using Deep Neural Networks,Thijs Kooi and Nico Karssemeijer,a908e3775fd064b0d249728a7261cfb1efa13b87,"['5e3b8647dd6da802cd06a3e8f193d4b2f2823410', 'a908e3775fd064b0d249728a7261cfb1efa13b87']","title matching: single bibkey with multiple_ss_ids (['5e3b8647dd6da802cd06a3e8f193d4b2f2823410', 'a908e3775fd064b0d249728a7261cfb1efa13b87']), took the first one with most citations",2017.0
753,Kort15,article,4D}-{CTA} in Neurovascular Disease: A Review,Hans G. J. Kortman and Ewoud J. Smit and Marcel T. H. Oei and Rashindra Manniesing and Mathias Prokop and Frederick J. A. Meijer,88b86ad75e10c7dac7b70edbd05ed494d699ffb0,"['7c83ece3400fa10da80bd363c15dd96eded51c9f', '88b86ad75e10c7dac7b70edbd05ed494d699ffb0']","title matching: single bibkey with multiple_ss_ids (['7c83ece3400fa10da80bd363c15dd96eded51c9f', '88b86ad75e10c7dac7b70edbd05ed494d699ffb0']), took the first one with most citations",2015.0
