,bibkey,type,title,authors,ss_id,all_ss_ids,comment,year
1693,Zrei18,article,Deep learning analysis of the myocardium in coronary {CT} angiography for identification of patients with functionally significant coronary artery stenosis,Majd Zreik and Nikolas Lessmann and Robbert W. van Hamersvelt and Jelmer M. Wolterink and Michiel Voskuil and Max A. Viergever and Tim Leiner and Ivana I{\v{s}}gum,,,,2018.0
1705,Hude20,article,Application of a risk-management framework for integration of stromal tumor-infiltrating lymphocytes in clinical trials.,"Hudeček, Jan and Voorwerk, Leonie and van Seijen, Maartje and Nederlof, Iris and de Maaker, Michiel and van den Berg, Jose and van de Vijver, Koen K. and Sikorska, Karolina and Adams, Sylvia and Demaria, Sandra and Viale, Giuseppe and Nielsen, Torsten O. and Badve, Sunil S. and Michiels, Stefan and Symmans, William Fraser and Sotiriou, Christos and Rimm, David L. and Hewitt, Stephen M. and Denkert, Carsten and Loibl, Sibylle and Loi, Sherene and Bartlett, John M. S. and Pruneri, Giancarlo and Dillon, Deborah A. and Cheang, Maggie C. U. and Tutt, Andrew and Hall, Jacqueline A. and Kos, Zuzana and Salgado, Roberto and Kok, Marleen and Horlings, Hugo M. and Group, International Immuno-Oncology Biomarker Working",c52daf1cb971120c4083116cfc213acbaac6faaf,"['c52daf1cb971120c4083116cfc213acbaac6faaf', 'cde27a74addf80ca2b3385a32966d51d35e0b2ff']","title matching: single bibkey with multiple_ss_ids (['c52daf1cb971120c4083116cfc213acbaac6faaf', 'cde27a74addf80ca2b3385a32966d51d35e0b2ff']), took the first one with most citations",2020.0
1708,Bohn22,article,Digital Implant Planning in Patients with Ectodermal Dysplasia: Clinical Report.,"Bohner, Lauren and Vinayahalingam, Shankeeth and Kleinheinz, Johannes and Hanisch, Marcel",,,,2022.0
1709,Naik22,article,Transforming healthcare through a digital revolution: A review of digital healthcare technologies and solutions.,"Naik, Nithesh and Hameed, B. M. Zeeshan and Sooriyaperakasam, Nilakshman and Vinayahalingam, Shankeeth and Patil, Vathsala and Smriti, Komal and Saxena, Janhavi and Shah, Milap and Ibrahim, Sufyan and Singh, Anshuman and Karimi, Hadis and Naganathan, Karthickeyan and Shetty, Dasharathraj K. and Rai, Bhavan Prasad and Chlosta, Piotr and Somani, Bhaskar K.",,,,2022.0
1712,Bemp22,article,The role of muscular traction in the occurrence of skeletal relapse after advancement bilateral sagittal split osteotomy (BSSO): A systematic review.,"Van den Bempt, Maxim and Vinayahalingam, Shankeeth and Han, Michael D. and Bergé, Stefaan J. and Xi, Tong",,,,2022.0
1713,Fehe22,article,Emulating Clinical Diagnostic Reasoning for Jaw Cysts with Machine Learning.,"Feher, Balazs and Kuchler, Ulrike and Schwendicke, Falk and Schneider, Lisa and Cejudo Grano de Oro, Jose Eduardo and Xi, Tong and Vinayahalingam, Shankeeth and Hsu, Tzu-Ming Harry and Brinz, Janet and Chaurasia, Akhilanand and Dhingra, Kunaal and Gaudin, Robert Andre and Mohammad-Rahimi, Hossein and Pereira, Nielsen and Perez-Pastor, Francesc and Tryfonos, Olga and Uribe, Sergio E. and Hanisch, Marcel and Krois, Joachim",,,,2022.0
1714,Esch22,article,A Survey on the Use of Artificial Intelligence by Clinicians in Dentistry and Oral and Maxillofacial Surgery.,"Eschert, Tim and Schwendicke, Falk and Krois, Joachim and Bohner, Lauren and Vinayahalingam, Shankeeth and Hanisch, Marcel",,,,2022.0
1715,Chen22,article,Is the pattern of mandibular asymmetry in mild craniofacial microsomia comparable to non-syndromic class II asymmetry?,"Chen, Yun-Fang and Vinayahalingam, Shankeeth and Bergé, Stefaan and Liao, Yu-Fang and Maal, Thomas and Xi, Tong",,,,2022.0
1717,Sadr23,article,Deep Learning for Detection of Periapical Radiolucent Lesions: A Systematic Review and Meta-analysis of Diagnostic Test Accuracy.,"Sadr, Soroush and Mohammad-Rahimi, Hossein and Motamedian, Saeed Reza and Zahedrozegar, Samira and Motie, Parisa and Vinayahalingam, Shankeeth and Dianat, Omid and Nosrat, Ali",,,,2023.0
1720,Graa23,article,MRI image features with an evident relation to low back pain: a narrative review,"van der Graaf, Jasper W and Kroeze, Robert Jan and Buckens, Constantinus FM and Lessmann, Nikolas and van Hooff, Miranda L",,,,2023.0
1722,Alves22c,inproceedings,Uncertainty-Guided Self-learning Framework for Semi-supervised Multi-organ Segmentation,"Alves, Nat{\'a}lia and de Wilde, Bram",,,,2022.0
1725,Bosma23a,inproceedings,Reproducibility of Training Deep Learning Models for Medical Image Analysis,Joeran Bosma and Dr{\'e} Peeters and Nat{\'a}lia Alves and Anindo Saha and Zaigham Saghir and Colin Jacobs and Henkjan Huisman,,,,2023.0
1732,Spro23,inproceedings,nnUNet meets pathology: bridging the gap for application to whole-slide images and computational biomarkers,Joey Spronck and Thijs Gelton and Leander van Eekelen and Joep Bogaerts and Leslie Tessier and Mart van Rijthoven and Lieke van der Woude and Michel van den Heuvel and Willemijn Theelen and Jeroen van der Laak and Francesco Ciompi,,,,2023.0
1740,Vend23,inproceedings,Automatic quantification of {TSR} as a prognostic marker for pancreatic cancer.,"Vendittelli, Pierpaolo and Bokhorst, John-Melle and Smeets, Esther Markus and Kryklyva, Valentyna and Brosens, Lodewijk and Verbeke, Caroline and Litjens, Geert",,,,2023.0
